{
  "@context": [
    "https://www.w3.org/ns/credentials/v2",
    {
      "CredentialStatusList2017": "https://example.org/examples#CredentialStatusList2017"
    }
  ],
  "type": [
    "VerifiableCredential"
  ],
  "issuer": "did:example:issuer",
  "credentialSubject": {
    "id": "did:example:subject"
  },
  "credentialStatus": {
    "id": "did:example:status",
    "type": "CredentialStatusList2017"
  }
}
