{
  "@context": [
    "https://www.w3.org/ns/credentials/v2"
  ],
  "type": [
    "VerifiableCredential"
  ],
  "issuer": {
    "id": "did:example:issuer",
    "description": {
      "@value": "An Example Issuer",
      "@language": "en"
    }
  },
  "credentialSubject": {
    "id": "did:example:subject"
  }
}
