{
  "@context": [
    "https://www.w3.org/ns/credentials/v2",
    "https://www.w3.org/ns/credentials/examples/v2"
  ],
  "type": [
    "VerifiableCredential"
  ],
  "id": "https://example.org/credentials/1",
  "issuer": "did:example:issuer",
  "credentialSubject": {
    "description": "A single id test for VC 2.0"
  }
}
