{
  "@context": [
    "https://www.w3.org/ns/credentials/v2",
    {
      "ExampleTestCredential": "https://example.org/#ExampleTestCredential"
    }
  ],
  "type": [
    "VerifiableCredential",
    "ExampleTestCredential"
  ],
  "issuer": "did:example:issuer",
  "credentialSubject": {
    "id": "did:example:subject"
  }
}
