{
  "@context": [
    "https://www.w3.org/ns/credentials/v2",
    {
      "DocumentVerification2018": "https://example.org/examples#DocumentVerification2018"
    }
  ],
  "type": [
    "VerifiableCredential"
  ],
  "issuer": "did:example:issuer",
  "credentialSubject": {
    "id": "did:example:subject"
  },
  "evidence": [
    {
      "type": "DocumentVerification2018"
    },
    {
      "type": "DocumentVerification2018"
    }
  ]
}
