{
  "@context": [
    "https://www.w3.org/ns/credentials/v2"
  ],
  "type": [
    "https://example.org/#ExampleCredential1",
    "https://example.org/#ExampleCredential2",
    "VerifiableCredential"
  ],
  "validFrom": "2023-02-23T21:41:38Z",
  "issuer": "did:example:issuer",
  "credentialSubject": {
    "id": "did:example:subject"
  }
}
