{
  "@context": [
    "https://www.w3.org/ns/credentials/v2"
  ],
  "type": [
    "VerifiableCredential"
  ],
  "credentialSchema": {
    "type": "https://example.org/#ExampleTestSuiteSchema",
    "id": "did:example:schemas/1"
  },
  "issuer": "did:example:issuer",
  "credentialSubject": {
    "id": "did:example:subject"
  }
}
