{
  "@context": [
    "https://www.w3.org/ns/credentials/v2",
    {
      "OdrlPolicy2017": "https://example.org/examples#OdrlPolicy2017"
    }
  ],
  "type": [
    "VerifiableCredential"
  ],
  "issuer": "did:example:issuer",
  "credentialSubject": {
    "id": "did:example:subject"
  },
  "termsOfUse": {
    "type": "OdrlPolicy2017"
  }
}
